{
  "$schema": "https://json-schema.org/draft/2020-12/schema",
  "title": "EventEnvelope",
  "description": "C1: envelope shared by every JetStream message. Published on subject oe.<type>.<tenant_id> with header Nats-Msg-Id = id.",
  "type": "object",
  "required": ["id", "type", "schema_version", "tenant_id", "occurred_at", "source", "contact_id", "data"],
  "additionalProperties": false,
  "properties": {
    "id": {
      "description": "UUID v7, lowercase. Also the JetStream dedup key (Nats-Msg-Id).",
      "type": "string",
      "format": "uuid",
      "pattern": "^[0-9a-f]{8}-[0-9a-f]{4}-7[0-9a-f]{3}-[89ab][0-9a-f]{3}-[0-9a-f]{12}$"
    },
    "type": {
      "description": "Dotted event type, e.g. contacts.upserted. First segment picks the stream.",
      "type": "string",
      "pattern": "^[a-z_]+(\\.[a-z_]+)+$"
    },
    "schema_version": {
      "description": "Version of the data payload schema for this type.",
      "type": "integer",
      "minimum": 1
    },
    "tenant_id": {
      "description": "Tenant UUID, lowercase.",
      "type": "string",
      "format": "uuid",
      "pattern": "^[0-9a-f]{8}-[0-9a-f]{4}-[0-9a-f]{4}-[0-9a-f]{4}-[0-9a-f]{12}$"
    },
    "occurred_at": {
      "description": "RFC 3339 timestamp with exactly millisecond precision.",
      "type": "string",
      "format": "date-time",
      "pattern": "^[0-9]{4}-[0-9]{2}-[0-9]{2}T[0-9]{2}:[0-9]{2}:[0-9]{2}\\.[0-9]{3}(Z|[+-][0-9]{2}:[0-9]{2})$"
    },
    "source": {
      "description": "Name of the emitting service, e.g. core, tracker.",
      "type": "string",
      "pattern": "^[a-z][a-z0-9-]*$"
    },
    "contact_id": {
      "description": "Contact UUID, or null when the event is not tied to a contact.",
      "type": ["string", "null"],
      "format": "uuid",
      "pattern": "^[0-9a-f]{8}-[0-9a-f]{4}-[0-9a-f]{4}-[0-9a-f]{4}-[0-9a-f]{12}$"
    },
    "trace_parent": {
      "description": "Optional W3C Trace Context traceparent header value (version 00).",
      "type": "string",
      "pattern": "^00-[0-9a-f]{32}-[0-9a-f]{16}-[0-9a-f]{2}$"
    },
    "data": {
      "description": "Type-specific payload, constrained by contracts/events/<type>.schema.json.",
      "type": "object"
    }
  }
}
