{
  "id": "01926f3a-9c1d-7abc-9def-0123456789a1",
  "type": "contacts.upserted",
  "schema_version": 1,
  "tenant_id": "01926f00-0000-7000-8000-000000000001",
  "occurred_at": "2026-09-18T10:00:00.123Z",
  "source": "core",
  "contact_id": "01926f3a-0000-7000-a000-00000000002a",
  "data": {
    "version": 3,
    "fields": {
      "1": "Ana",
      "2": "Pérez",
      "3": "ana@example.com",
      "6": "1990-04-21",
      "7": 2,
      "9": "AR",
      "31": 1,
      "40": "2026-09-01T08:00:00.000Z",
      "41": "2026-09-18T10:00:00.123Z",
      "1000": 42.5,
      "1001": [1, 3],
      "1002": true
    },
    "changed": ["1", "31", "41"],
    "lists": ["01926f3b-0000-7000-8000-000000000010"]
  }
}
