{
  "id": "01926f3a-9c1d-7abc-9def-0123456789a3",
  "type": "consent.changed",
  "schema_version": 1,
  "tenant_id": "01926f00-0000-7000-8000-000000000001",
  "occurred_at": "2026-09-18T10:00:00.123Z",
  "source": "core",
  "contact_id": "01926f3a-0000-7000-a000-00000000002a",
  "data": {
    "channel": "email",
    "value": 1,
    "source": "form",
    "text": "Acepto recibir novedades por email."
  }
}
