{
  "id": "01926f3a-9c1d-7abc-9def-0123456789ac",
  "type": "system.job.completed",
  "schema_version": 1,
  "tenant_id": "01926f00-0000-7000-8000-000000000001",
  "occurred_at": "2026-09-17T12:34:56.789Z",
  "source": "importer",
  "contact_id": null,
  "trace_parent": "00-4bf92f3577b34da6a3ce929d0e0e4736-00f067aa0ba902b7-01",
  "data": {
    "job_id": "01926f3a-0000-7000-a000-0000000000e1",
    "kind": "export",
    "status": "succeeded",
    "created_by": "01926f3a-1111-7000-8000-000000000099",
    "rows_read": 1000000,
    "result_url": "http://localhost:9000/exports/01926f00-0000-7000-8000-000000000001/01926f3a-0000-7000-a000-0000000000e1.csv?X-Amz-Expires=86400",
    "result_url_expires_at": "2026-09-18T12:34:56.789Z",
    "error": null
  }
}
